{
  "manifest": {
    "input_refs": {},
    "resolved_digests": {},
    "timestamps": {},
    "harness_version": "1.0",
    "model_ids": ["model-a"],
    "environment": {},
    "status": "success"
  },
  "scorecard": {
    "normalized_metrics": {},
    "metric_definitions": {}
  },
  "cases": [
    {
      "case_id": "case-1",
      "per_trial_outputs": [],
      "evaluator_outputs": []
    }
  ],
  "failures": []
}
