{
  "manifest": {
    "input_refs": {},
    "resolved_digests": {},
    "timestamps": {},
    "harness_version": "1.0",
    "model_ids": [],
    "environment": {},
    "status": "success"
  },
  "scorecard": {
    "normalized_metrics": {},
    "metric_definitions": {}
  },
  "cases": [],
  "failures": []
}
